{
  "slug": "factory-ai",
  "name": "Factory",
  "nameZh": "Factory",
  "description": "企业级软件开发智能体平台：Droids 智能体自动化编码、测试与部署，CLI 版 droid 位居 Terminal-Bench 榜首",
  "descriptionEn": "Agent-native software development platform: Factory Droids automate coding, testing and deployment; its droid CLI tops Terminal-Bench",
  "descriptionJa": "エージェントネイティブなソフトウェア開発プラットフォーム。Droidsエージェントがコーディング・テスト・デプロイを自動化し、CLI版droidはTerminal-Benchで首位",
  "descriptionEs": "Plataforma de desarrollo de software nativa de agentes: los Droids de Factory automatizan codificación, pruebas y despliegue; su CLI droid lidera Terminal-Bench",
  "descriptionFr": "Plateforme de développement logiciel native agents : les Droids de Factory automatisent codage, tests et déploiement ; son CLI droid domine Terminal-Bench",
  "url": "https://factory.com",
  "logo": "/logos/tools/factory-ai.png",
  "category": "Agent",
  "tags": [
    "Freemium",
    "API"
  ],
  "featured": false,
  "developer": "Factory",
  "platforms": {
    "web": true,
    "windows": true,
    "macos": true,
    "ios": false,
    "android": false,
    "linux": true,
    "browser_extension": false,
    "api": "unknown"
  }
}
