{
  "slug": "relume",
  "name": "Relume",
  "nameZh": "Relume",
  "description": "面向专业设计师与开发者的 AI 建站前置工具，输入提示即生成站点地图与线框，AI 文案填充，一键导出 Figma、Webflow 与 React，配套千余组件库与 Webflow Chrome 扩展，免费档起步",
  "descriptionEn": "AI website tool for pro designers and developers: generate a full sitemap and wireframes from a prompt with AI copywriting, then export to Figma, Webflow and React in one click — backed by a 1,000+ component library and a Webflow Chrome extension, free to start",
  "descriptionJa": "プロのデザイナーと開発者向けAI建設前工具。プロンプトからサイトマップとワイヤーフレームを生成、AIコピー自動入力、Figma・Webflow・Reactへワンクリック書き出し。1000超のコンポーネントライブラリとWebflow Chrome拡張を備える。無料から",
  "descriptionEs": "Herramienta web con IA para diseñadores y desarrolladores pro: genera un mapa del sitio y wireframes completos desde un prompt con redacción por IA, y exporta a Figma, Webflow y React con un clic; respaldada por una biblioteca de más de 1000 componentes y una extensión de Chrome para Webflow, gratis para empezar",
  "descriptionFr": "Outil web par IA pour designers et développeurs pro : générez un plan de site et des wireframes complets depuis un prompt avec rédaction IA, puis exportez vers Figma, Webflow et React en un clic ; adossé à une bibliothèque de plus de 1000 composants et une extension Chrome pour Webflow, gratuit pour démarrer",
  "url": "https://www.relume.ai",
  "logo": "/logos/tools/relume.png",
  "category": "Design",
  "tags": [
    "Freemium"
  ],
  "featured": false,
  "developer": "Relume",
  "platforms": {
    "web": true,
    "windows": false,
    "macos": false,
    "ios": false,
    "android": false,
    "linux": false,
    "browser_extension": true,
    "api": false
  }
}
