{
  "slug": "copilot-studio",
  "name": "Microsoft Copilot Studio",
  "nameZh": "微软 Copilot Studio",
  "description": "低代码创建 Teams 与 Microsoft 365 智能体。",
  "descriptionEn": "Build low-code agents for Teams and Microsoft 365.",
  "descriptionJa": "Teams/M365向けAIエージェント。",
  "descriptionEs": "Crea agentes low-code para Teams y Microsoft 365.",
  "descriptionFr": "Agents IA low-code pour Teams et M365.",
  "url": "https://copilotstudio.microsoft.com",
  "logo": "/logos/tools/copilot-studio.ico",
  "category": "Agent",
  "tags": [
    "Paid"
  ],
  "featured": false,
  "developer": "Microsoft",
  "platforms": {
    "web": true,
    "windows": false,
    "macos": false,
    "ios": false,
    "android": false,
    "linux": false,
    "browser_extension": false,
    "api": true
  }
}
