{
  "slug": "grok",
  "homeFeatured": true,
  "name": "Grok",
  "nameZh": "Grok",
  "description": "SpaceX 旗下（原 xAI，现称 SpaceXSI）的 AI 助手，实时接入 X 平台数据，擅长推理和实时搜索",
  "descriptionEn": "The AI assistant now under SpaceX (formerly xAI, now branded SpaceXSI), with live X data access and strong reasoning and real-time search",
  "descriptionJa": "SpaceX 傘下（旧 xAI、現 SpaceXSI）のAIアシスタント。X プラットフォームのデータにリアルタイム接続し、推論とリアルタイム検索に強い",
  "descriptionEs": "El asistente de IA ahora bajo SpaceX (antes xAI, hoy con la marca SpaceXSI), con acceso en tiempo real a X y buen razonamiento y búsqueda",
  "descriptionFr": "L'assistant IA désormais rattaché à SpaceX (ex-xAI, aujourd'hui SpaceXSI), connecté aux données de X en temps réel, à l'aise en raisonnement et en recherche",
  "url": "https://grok.com",
  "logo": "/logos/tools/grok.png",
  "category": "Chat",
  "tags": [
    "Freemium",
    "API"
  ],
  "featured": true,
  "developer": "xAI",
  "platforms": {
    "web": true,
    "windows": "unknown",
    "macos": true,
    "ios": true,
    "android": true,
    "linux": false,
    "browser_extension": false,
    "api": true
  }
}
