{
  "slug": "mistral",
  "name": "Mistral AI",
  "nameZh": "Mistral AI",
  "description": "欧洲领先的开源大模型公司，Le Chat 对话产品，旗舰 Mistral Large 系列原生多模态",
  "descriptionEn": "Europe's leading open-weight model lab, with the Le Chat assistant and the natively multimodal Mistral Large flagship",
  "descriptionJa": "欧州を代表するオープンウェイトモデル企業。対話製品 Le Chat と、ネイティブマルチモーダルの Mistral Large 系列が柱",
  "descriptionEs": "El laboratorio de modelos open weight líder de Europa, con el asistente Le Chat y la serie insignia Mistral Large, nativamente multimodal",
  "descriptionFr": "Le laboratoire européen de modèles open weight, avec l'assistant Le Chat et la gamme phare Mistral Large, nativement multimodale",
  "url": "https://chat.mistral.ai",
  "logo": "/logos/tools/mistral.png",
  "category": "Foundation Models",
  "tags": [
    "Free",
    "Open Source",
    "API"
  ],
  "featured": true,
  "developer": "Mistral AI",
  "platforms": {
    "web": true,
    "windows": "unknown",
    "macos": false,
    "ios": true,
    "android": true,
    "linux": false,
    "browser_extension": false,
    "api": true
  }
}
