{
  "slug": "meta-ai",
  "name": "Meta AI",
  "nameZh": "Meta AI",
  "description": "Meta 推出的 AI 对话助手，接入 Meta 最新旗舰模型，支持文本与图像理解，可在 meta.ai 及 WhatsApp、Instagram 等处使用",
  "descriptionEn": "Meta's AI assistant, built on Meta's latest flagship model, with text and image understanding across meta.ai, WhatsApp and Instagram",
  "descriptionJa": "Meta のAIアシスタント。Meta 最新旗艦モデルを搭載し、テキストと画像の理解に対応。meta.ai や WhatsApp、Instagram で利用可能",
  "descriptionEs": "Asistente de IA de Meta, construido sobre el modelo insignia más reciente de la compañía, con comprensión de texto e imagen en meta.ai, WhatsApp e Instagram",
  "descriptionFr": "L'assistant IA de Meta, bâti sur le modèle phare le plus récent de l'entreprise, avec compréhension de texte et d'image sur meta.ai, WhatsApp et Instagram",
  "url": "https://www.meta.ai",
  "logo": "/logos/tools/meta-ai.png",
  "category": "Chat",
  "tags": [
    "Free",
    "Open Source",
    "API"
  ],
  "featured": true,
  "developer": "Meta",
  "platforms": {
    "web": true,
    "windows": false,
    "macos": false,
    "ios": true,
    "android": true,
    "linux": false,
    "browser_extension": false,
    "api": true
  }
}
