{
  "slug": "grok-build",
  "name": "Grok Build",
  "nameZh": "Grok Build",
  "description": "SpaceXSI（原 xAI）官方终端 AI 编程智能体，由 Grok 4.7 驱动，支持子代理并行、Plan 模式与全屏终端 TUI，可无头运行或经 ACP 接入",
  "descriptionEn": "SpaceXSI's (formerly xAI) official terminal AI coding agent, powered by Grok 4.7, with parallel sub-agents, Plan Mode and a fullscreen terminal TUI; runs headlessly in scripts or via the Agent Client Protocol",
  "descriptionJa": "SpaceXSI（旧 xAI）公式のターミナル AI コーディングエージェント。Grok 4.7 で動作し、サブエージェント並列・Plan モード・フルスクリーンのターミナル TUI を備え、スクリプトでのヘッドレス実行や ACP 経由の接続に対応",
  "descriptionEs": "El agente de código oficial en terminal de SpaceXSI (antes xAI), impulsado por Grok 4.7, con subagentes en paralelo, modo Plan y una TUI de terminal a pantalla completa; funciona sin interfaz en scripts o vía el Agent Client Protocol",
  "descriptionFr": "L'agent de code terminal officiel de SpaceXSI (ex-xAI), propulsé par Grok 4.7, avec sous-agents parallèles, mode Plan et un TUI terminal plein écran ; s'exécute en mode headless dans des scripts ou via l'Agent Client Protocol",
  "url": "https://x.ai/cli",
  "logo": "/logos/tools/grok-build.png",
  "category": "Code",
  "tags": [
    "Paid",
    "Beta"
  ],
  "featured": false,
  "developer": "xAI",
  "platforms": {
    "web": false,
    "windows": "unknown",
    "macos": true,
    "ios": false,
    "android": false,
    "linux": true,
    "browser_extension": false,
    "api": true
  }
}
