{
  "slug": "ui-ux-pro-max",
  "name": "UI UX Pro Max",
  "nameZh": "UI UX Pro Max",
  "description": "为 Claude Code 等 AI 智能体提供专业设计智能的 AI Skill，支持 45+ 设计风格、8 种技术栈、39 个网站演示",
  "descriptionEn": "Design intelligence skill for AI agents — 45+ design styles, 8 tech stacks, 39 website demos, color palettes, typography, and UX guidelines",
  "descriptionJa": "AIエージェントのためのデザインインテリジェンススキル — 45+のデザインスタイル、8つのテクノロジースタック、39のウェブサイトデモ",
  "descriptionEs": "Skill de inteligencia de diseño para agentes de IA — 45+ estilos de diseño, 8 stacks tecnológicos, 39 demostraciones de sitios web",
  "descriptionFr": "Skill d'intelligence de conception pour les agents IA — 45+ styles de design, 8 piles technologiques, 39 démos de sites web",
  "url": "https://github.com/nextlevelbuilder/ui-ux-pro-max-skill",
  "logo": "/logos/tools/ui-ux-pro-max.svg",
  "category": "Design",
  "tags": [
    "Free",
    "Open Source"
  ],
  "featured": false,
  "developer": "nextlevelbuilder",
  "developerZh": "nextlevelbuilder",
  "platforms": {
    "web": true,
    "windows": false,
    "macos": false,
    "ios": false,
    "android": false,
    "linux": false,
    "browser_extension": false,
    "api": true
  }
}
