{
  "slug": "devin",
  "homeFeatured": true,
  "name": "Devin",
  "nameZh": "Devin",
  "description": "Cognition 推出的自主 AI 软件工程师，云端并行智能体独立完成编码任务；配套的桌面 IDE Devin Desktop（原 Windsurf）在本站另有独立条目",
  "descriptionEn": "Autonomous AI software engineer by Cognition; parallel cloud agents complete coding tasks end-to-end. Its companion desktop IDE, Devin Desktop (formerly Windsurf), has its own entry on this site",
  "descriptionJa": "Cognition の自律 AI ソフトウェアエンジニア。クラウド上の並列エージェントがコーディングタスクをエンドツーエンドで完遂。連携するデスクトップ IDE「Devin Desktop（旧 Windsurf）」は本サイトに別項目あり",
  "descriptionEs": "Ingeniero de software autónomo de Cognition; agentes paralelos en la nube completan tareas de código de principio a fin. Su IDE de escritorio asociado, Devin Desktop (antes Windsurf), tiene entrada propia en este sitio",
  "descriptionFr": "Ingénieur logiciel autonome de Cognition ; des agents cloud parallèles mènent les tâches de code de bout en bout. Son IDE de bureau associé, Devin Desktop (ex-Windsurf), dispose de sa propre entrée sur ce site",
  "url": "https://devin.ai",
  "logo": "/logos/tools/devin.png",
  "category": "Agent",
  "tags": [
    "Freemium",
    "API"
  ],
  "featured": true,
  "developer": "Cognition",
  "platforms": {
    "web": true,
    "windows": true,
    "macos": true,
    "ios": false,
    "android": false,
    "linux": "unknown",
    "browser_extension": false,
    "api": true
  }
}
