{
  "slug": "tabnine",
  "name": "Tabnine",
  "nameZh": "Tabnine",
  "description": "AI 代码补全工具（2026 年 7 月 30 日被 Tricentis 收购，独立品牌页已下线），支持多种 IDE，注重代码隐私",
  "descriptionEn": "AI code completion tool (acquired by Tricentis on July 30, 2026; its standalone brand page is gone), multi-IDE support with a privacy-first focus",
  "descriptionJa": "AIコード補完ツール（2026年7月30日 Tricentis に買収され、独立ブランドページは閉鎖）。複数 IDE 対応、プライバシー重視",
  "descriptionEs": "Asistente de autocompletado de código (comprado por Tricentis el 30 de julio de 2026; su página de marca independiente ya no existe), compatible con varias IDE y centrado en la privacidad",
  "descriptionFr": "Outil de complétion de code (racheté par Tricentis le 30 juillet 2026 ; sa page de marque indépendante a disparu), compatible avec plusieurs IDE et axé sur la confidentialité",
  "url": "https://www.tricentis.com/products",
  "logo": "/logos/tools/tabnine.png",
  "category": "Code",
  "tags": [
    "Freemium"
  ],
  "featured": false,
  "developer": "Tabnine",
  "platforms": {
    "web": false,
    "windows": true,
    "macos": true,
    "ios": false,
    "android": false,
    "linux": true,
    "browser_extension": false,
    "api": "unknown"
  }
}
